{
  "evidence_format": 2,
  "issue": 2255,
  "source_provenance": {
    "mode": "change",
    "paths": [
      "docs/PROJECT_MAP.md",
      "docs/specs/SPEC-0010-winui-shell.md",
      "docs/state/BASELINE.md",
      "tools/extract-theme-fallbacks.ps1"
    ],
    "digest_algorithm": "sha256-git-source-set-v1",
    "digest": "43e24f35f2f7d3b1844f9e0fdcccbc77de4201fe61d926f99af92e5cc18c0ff4"
  },
  "metadata": {
    "scope": "theme-fallback-extractor-tools-v1",
    "environment_fingerprint": "windows-amd64-pwsh-7.6.4-theme-fallback-extractor",
    "commands": [
      "pwsh -NoProfile -File tools/handoff-check.ps1 -Issue 2255",
      "pwsh -NoProfile -File tools/delivery-audit.ps1 -Issue 2255",
      "pwsh -NoProfile -File tools/docs-check.ps1",
      "pwsh -NoProfile -File tools/source-policy.ps1",
      "pwsh -NoProfile -File tools/source-only-ci-check.ps1",
      "pwsh -NoProfile -File tools/extract-theme-fallbacks.ps1 -SelfTest",
      "pwsh -NoProfile -File tools/extract-theme-fallbacks.ps1 -VerifyCommitted",
      "pwsh -NoProfile -File tools/evidence-audit.ps1 -SelfTest",
      "pwsh -NoProfile -File tools/evidence-audit.ps1",
      "git diff --check"
    ],
    "results": [
      {
        "command": "handoff admission",
        "status": "pass",
        "detail": "AI handoff checks passed (#2255@codex/2255-theme-fallback-extractor; issue-based ownership, scope and Git state)."
      },
      {
        "command": "delivery audit",
        "status": "pass",
        "detail": "Delivery audit passed for Issue #2255 (1 handoff(s), 0 bounded open PR(s) inspected)."
      },
      {
        "command": "documentation and source policy gates",
        "status": "pass",
        "detail": "docs-check passed (91 required paths, 26 specs; live measurement: 848 tracked paths, 383 repository JSON files, 40 markdown links), source-policy passed for 848 tracked paths, and source-only-ci-check passed (4 workflows, 848 tracked paths)."
      },
      {
        "command": "extractor self-test",
        "status": "pass",
        "detail": "tools/extract-theme-fallbacks.ps1 -SelfTest passed 2/2 groups: (1) synthetic XAML fixture extraction rules match the full expected row sequence, including Light-first first-wins, root fallback, StaticResource alias chains degrading to the recorded elevation/acrylic approximations, hex normalization, Thickness/CornerRadius quirks, skip types, and unique-key rejection; (2) committed-block structural invariants pass (16-space BEGIN/END markers, 3242 committed rows, 12-space row format, unique keys, known token prefixes, approximation run boundary, and invariant-culture case-insensitive sort of both the base run and the approximation run)."
      },
      {
        "command": "extractor verify committed",
        "status": "pass",
        "detail": "tools/extract-theme-fallbacks.ps1 -VerifyCommitted decoded the pinned microsoft.windowsappsdk 1.7.250401001 generic.xaml (SHA256 0A32014884636EFE31FE7D71F6C620705E3D5FC3A90ADD1EE93E03F478912408) and byte-for-byte matched the committed block in apps/winui-shell/App.xaml.cs: 222459 bytes, 3242 rows, committed dictionary unchanged."
      }
    ],
    "limitations": [
      "The byte-for-byte -VerifyCommitted result was produced on this machine against the local pinned NuGet package copy (SHA256 recorded above); reproducibility depends on obtaining the same pinned WindowsAppSDK version, and hosted CI does not run this verification.",
      "The extraction rules are reverse-engineered from the committed block and the pinned framework XAML; a future WindowsAppSDK update that changes generic.xaml token handling would require re-verification before regenerating rows.",
      "The committed dictionary in apps/winui-shell/App.xaml.cs is verified, not regenerated; no product source, schema, wire, DSP, or build contract is modified.",
      "The script targets PowerShell 7 and was verified on pwsh 7.6.4 (including parameter-set adjustments for this runtime).",
      "No claim of physical audio, driver, WaveRT, signing, installer, or release readiness; the compatibility preview remains not formal XAML, accessibility, or release evidence."
    ],
    "tool_versions": {
      "powershell": "pwsh 7.6.4 local",
      "git": "git 2.x local"
    },
    "started_at": "2026-09-02T10:05:00+08:00",
    "finished_at": "2026-09-02T11:17:58+08:00"
  }
}

